{
  "version": "0.1.0",
  "meta": {
    "name": "MF04 microchannel orifice-balanced",
    "description": "MF04 three-sink orifice rebalance with energy rTh/q. Manifold geometry sparse in PDF; rLin from fRe=57 HSAR1 bundle.",
    "createdAt": "2026-09-07T00:00:00Z",
    "updatedAt": "2026-09-07T00:00:00Z"
  },
  "units": {
    "system": "SI",
    "length": "m",
    "pressure": "Pa",
    "flow": "m3/s",
    "temperature": "K",
    "power": "W"
  },
  "fluids": {
    "water-20C": {
      "id": "water-20C",
      "name": "Water 20 °C",
      "phase": "liquid",
      "rho": 998.2,
      "mu": 0.001002,
      "cp": 4182,
      "k": 0.598,
      "beta": 0.000207,
      "Tref": 293.15
    }
  },
  "analysis": {
    "type": "steady",
    "flowRegime": "incompressible",
    "energy": true,
    "gravity": false,
    "convergence": {
      "massResidual": 1e-10,
      "energyResidual": 1e-8,
      "maxIter": 200,
      "relaxationP": 0.7,
      "relaxationQ": 0.7
    }
  },
  "nodes": [
    {
      "id": "inlet",
      "kind": "boundary",
      "x": 0,
      "y": 40,
      "z": 0,
      "fluid": "water-20C",
      "pFixed": 126325,
      "tFixed": 293.15
    },
    {
      "id": "outlet",
      "kind": "boundary",
      "x": 200,
      "y": 40,
      "z": 0,
      "fluid": "water-20C",
      "pFixed": 101325,
      "tFixed": 293.15
    },
    {
      "id": "J0",
      "kind": "junction",
      "x": 60,
      "y": 0,
      "z": 0,
      "fluid": "water-20C"
    },
    {
      "id": "O0",
      "kind": "junction",
      "x": 140,
      "y": 0,
      "z": 0,
      "fluid": "water-20C"
    },
    {
      "id": "J1",
      "kind": "junction",
      "x": 60,
      "y": 40,
      "z": 0,
      "fluid": "water-20C"
    },
    {
      "id": "O1",
      "kind": "junction",
      "x": 140,
      "y": 40,
      "z": 0,
      "fluid": "water-20C"
    },
    {
      "id": "J2",
      "kind": "junction",
      "x": 60,
      "y": 80,
      "z": 0,
      "fluid": "water-20C"
    },
    {
      "id": "O2",
      "kind": "junction",
      "x": 140,
      "y": 80,
      "z": 0,
      "fluid": "water-20C"
    }
  ],
  "links": [
    {
      "id": "feed-0",
      "from": "inlet",
      "to": "J0",
      "fluid": "water-20C",
      "component": {
        "type": "pipe",
        "lossModel": "darcy-weisbach",
        "geometry": {
          "L": 0.05,
          "D": 0.008,
          "eps": 0.0000015
        },
        "K": 0.5
      }
    },
    {
      "id": "orifice-0",
      "from": "J0",
      "to": "O0",
      "fluid": "water-20C",
      "component": {
        "type": "orifice",
        "lossModel": "k-factor",
        "geometry": {
          "L": 0,
          "D": 0.004,
          "eps": 0
        },
        "K": 18
      }
    },
    {
      "id": "hs-1",
      "name": "Heat sink 1",
      "from": "O0",
      "to": "outlet",
      "fluid": "water-20C",
      "component": {
        "type": "cold-plate",
        "lossModel": "linear",
        "geometry": {
          "L": 0.02,
          "D": 0.00012,
          "eps": 0,
          "A": 0.0000011520000000000002
        },
        "K": 0,
        "rLin": 34429253472.22222,
        "q": 70,
        "rTh": 0.18714285714285747
      }
    },
    {
      "id": "feed-1",
      "from": "inlet",
      "to": "J1",
      "fluid": "water-20C",
      "component": {
        "type": "pipe",
        "lossModel": "darcy-weisbach",
        "geometry": {
          "L": 0.05,
          "D": 0.008,
          "eps": 0.0000015
        },
        "K": 0.5
      }
    },
    {
      "id": "orifice-1",
      "from": "J1",
      "to": "O1",
      "fluid": "water-20C",
      "component": {
        "type": "orifice",
        "lossModel": "k-factor",
        "geometry": {
          "L": 0,
          "D": 0.004,
          "eps": 0
        },
        "K": 6
      }
    },
    {
      "id": "hs-2",
      "name": "Heat sink 2",
      "from": "O1",
      "to": "outlet",
      "fluid": "water-20C",
      "component": {
        "type": "cold-plate",
        "lossModel": "linear",
        "geometry": {
          "L": 0.02,
          "D": 0.00012,
          "eps": 0,
          "A": 0.0000011520000000000002
        },
        "K": 0,
        "rLin": 34429253472.22222,
        "q": 120,
        "rTh": 0.18583333333333343
      }
    },
    {
      "id": "feed-2",
      "from": "inlet",
      "to": "J2",
      "fluid": "water-20C",
      "component": {
        "type": "pipe",
        "lossModel": "darcy-weisbach",
        "geometry": {
          "L": 0.05,
          "D": 0.008,
          "eps": 0.0000015
        },
        "K": 0.5
      }
    },
    {
      "id": "orifice-2",
      "from": "J2",
      "to": "O2",
      "fluid": "water-20C",
      "component": {
        "type": "orifice",
        "lossModel": "k-factor",
        "geometry": {
          "L": 0,
          "D": 0.004,
          "eps": 0
        },
        "K": 0.4
      }
    },
    {
      "id": "hs-3",
      "name": "Heat sink 3",
      "from": "O2",
      "to": "outlet",
      "fluid": "water-20C",
      "component": {
        "type": "cold-plate",
        "lossModel": "linear",
        "geometry": {
          "L": 0.02,
          "D": 0.00012,
          "eps": 0,
          "A": 0.0000011520000000000002
        },
        "K": 0,
        "rLin": 34429253472.22222,
        "q": 200,
        "rTh": 0.14900000000000005
      }
    }
  ],
  "couplings": []
}
