{
  "version": "0.1.0",
  "meta": {
    "name": "MF11 single LCM at Table 1 point",
    "description": "MF11 hierarchical curve reuse / Table 1 LCM golden",
    "createdAt": "2026-09-07T00:00:00Z",
    "updatedAt": "2026-09-07T00:00:00Z"
  },
  "units": {
    "system": "SI",
    "length": "m",
    "pressure": "Pa",
    "flow": "m3/s",
    "temperature": "K",
    "power": "W"
  },
  "fluids": {
    "water-20C": {
      "id": "water-20C",
      "name": "Water 20 °C",
      "phase": "liquid",
      "rho": 998.2,
      "mu": 0.001002,
      "cp": 4182,
      "k": 0.598,
      "beta": 0.000207,
      "Tref": 293.15
    }
  },
  "analysis": {
    "type": "steady",
    "flowRegime": "incompressible",
    "energy": false,
    "gravity": false,
    "convergence": {
      "massResidual": 1e-10,
      "energyResidual": 1e-8,
      "maxIter": 200,
      "relaxationP": 0.7,
      "relaxationQ": 0.7
    }
  },
  "nodes": [
    {
      "id": "a",
      "kind": "boundary",
      "x": 0,
      "y": 0,
      "z": 0,
      "fluid": "water-20C",
      "pFixed": 125456.6495,
      "tFixed": 293.15
    },
    {
      "id": "b",
      "kind": "boundary",
      "x": 100,
      "y": 0,
      "z": 0,
      "fluid": "water-20C",
      "pFixed": 101325,
      "tFixed": 293.15
    }
  ],
  "links": [
    {
      "id": "lcm",
      "from": "a",
      "to": "b",
      "fluid": "water-20C",
      "component": {
        "type": "generic-resistance",
        "lossModel": "quadratic",
        "geometry": {
          "L": 0,
          "D": 0.01,
          "eps": 0
        },
        "K": 0,
        "rQuad": 421018091225084.4,
        "parallelCount": 1
      }
    }
  ],
  "couplings": []
}
