{
  "version": "0.1.0",
  "meta": {
    "name": "Pump and pipe, 15 m lift",
    "description": "Pump H = 30 − 2000 Q² (m, m³/s) feeding one pipe against 15 m static lift. Golden Case B.",
    "createdAt": "2026-09-07T00:00:00Z",
    "updatedAt": "2026-09-07T00:00:00Z"
  },
  "units": {
    "system": "SI",
    "length": "m",
    "pressure": "Pa",
    "flow": "m3/s",
    "temperature": "K",
    "power": "W"
  },
  "fluids": {
    "water-20C": {
      "id": "water-20C",
      "name": "Water 20 °C",
      "phase": "liquid",
      "rho": 998.2,
      "mu": 0.001002,
      "cp": 4182,
      "k": 0.598,
      "beta": 0.000207,
      "Tref": 293.15
    }
  },
  "analysis": {
    "type": "steady",
    "flowRegime": "incompressible",
    "energy": false,
    "gravity": true,
    "convergence": {
      "massResidual": 1e-10,
      "energyResidual": 1e-8,
      "maxIter": 80,
      "relaxationP": 0.85,
      "relaxationQ": 0.7
    }
  },
  "nodes": [
    {
      "id": "sump",
      "kind": "boundary",
      "x": 0,
      "y": 0,
      "z": 5,
      "fluid": "water-20C",
      "pFixed": 101325,
      "tFixed": 293.15
    },
    {
      "id": "pump-out",
      "kind": "junction",
      "x": 80,
      "y": 0,
      "z": 5,
      "fluid": "water-20C"
    },
    {
      "id": "discharge",
      "kind": "boundary",
      "x": 280,
      "y": 80,
      "z": 20,
      "fluid": "water-20C",
      "pFixed": 101325,
      "tFixed": 293.15
    }
  ],
  "links": [
    {
      "id": "pump",
      "from": "sump",
      "to": "pump-out",
      "fluid": "water-20C",
      "component": {
        "type": "pump",
        "lossModel": "darcy-weisbach",
        "geometry": { "L": 0, "D": 0.05, "eps": 0 },
        "K": 0,
        "pump": { "coeffs": [30, 0, -2000], "hMin": 0 }
      }
    },
    {
      "id": "pipe",
      "from": "pump-out",
      "to": "discharge",
      "fluid": "water-20C",
      "component": {
        "type": "pipe",
        "lossModel": "darcy-weisbach",
        "geometry": { "L": 100, "D": 0.05, "eps": 4.5e-5 },
        "K": 1.5
      }
    }
  ],
  "couplings": []
}
