{
  "version": "0.1.0",
  "meta": {
    "name": "MF09 bypass clearFraction=0.2",
    "description": "Heat-sink ∥ bypass clearance at fixed 10 SCFM air (MF09). Handbook Darcy on channels; no vendor curves.",
    "createdAt": "2026-09-07T00:00:00Z",
    "updatedAt": "2026-09-07T00:00:00Z"
  },
  "units": {
    "system": "SI",
    "length": "m",
    "pressure": "Pa",
    "flow": "m3/s",
    "temperature": "K",
    "power": "W"
  },
  "fluids": {
    "air-25C": {
      "id": "air-25C",
      "name": "Air 25 °C 1 atm",
      "phase": "gas",
      "rho": 1.184,
      "mu": 0.00001849,
      "cp": 1007,
      "k": 0.0262,
      "beta": 0.003356,
      "Tref": 298.15
    }
  },
  "analysis": {
    "type": "steady",
    "flowRegime": "incompressible",
    "energy": false,
    "gravity": false,
    "convergence": {
      "massResidual": 1e-10,
      "energyResidual": 1e-8,
      "maxIter": 200,
      "relaxationP": 0.7,
      "relaxationQ": 0.7
    }
  },
  "nodes": [
    {
      "id": "inlet",
      "kind": "junction",
      "x": 0,
      "y": 0,
      "z": 0,
      "fluid": "air-25C",
      "mdotSource": 0.005587857807999945
    },
    {
      "id": "outlet",
      "kind": "boundary",
      "x": 240,
      "y": 0,
      "z": 0,
      "fluid": "air-25C",
      "pFixed": 101325,
      "tFixed": 298.15
    }
  ],
  "links": [
    {
      "id": "sink",
      "name": "Heat sink channels",
      "from": "inlet",
      "to": "outlet",
      "fluid": "air-25C",
      "component": {
        "type": "duct",
        "lossModel": "darcy-weisbach",
        "geometry": {
          "L": 0.05588,
          "D": 0.004000954653937947,
          "eps": 0.0000015,
          "A": 0.000042580559999999994
        },
        "K": 1.5,
        "parallelCount": 46
      }
    },
    {
      "id": "bypass",
      "name": "Clearance bypass",
      "from": "inlet",
      "to": "outlet",
      "fluid": "air-25C",
      "component": {
        "type": "duct",
        "lossModel": "darcy-weisbach",
        "geometry": {
          "L": 0.05588,
          "D": 0.0040948598130841115,
          "eps": 0.0000015,
          "A": 0.0005564504999999998
        },
        "K": 1
      }
    }
  ],
  "couplings": []
}
